书名,作者,介绍,更新时间
我和她们穿越到北宋,任鸟飞, 顶级历史领域创作者张纯、顶级军事点评家李琳、顶级财经主播叶诗韵、科技圈废材女王麻晓娇、嫁接育苗农业女神袁倾城穿越到了宋哲宗末期，为阻止靖康之耻发生，她们决定从源头解决问题，也就是换掉快要登基的宋徽宗，而我就是她们选中的新皇帝。可她们不知道，我也是穿越者。本书原名《我和五个大美妞穿越到北宋》，又名：《高端的猎人往往以猎物的方式出现》、《我在五个跟我一块穿越的大美妞面前装土著》。 ,2025-03-10 00:41
北宋穿越指南,王梓钧, 如果穿越回宋代，是该吟诗作赋、风花雪月？还是厉兵秣马、争霸天下？不论如何，先填饱肚子再说。 ,2025-01-25 22:51
仙不是这么修的,凤嘲凰, 姓向的满天下抓魔头的时候，我没站出来，因为我不修魔功；姓向的满天下抓妖怪的时候，我没站出来，因为我不是妖怪；姓向的满天下抓剑修的时候，没人站出来为我们说话，因为他们不是剑修；姓向的满……他不抓人了，天下太平了。——《XX狱中随笔》 ,2025-03-09 09:00
LOL：重生S3，调教全联盟,青石离, 一不小心重回S3，打职业捞个英雄皮肤，创个俱乐部搞搞电竞豪门。没有系统没关系，电竞的野蛮时代，处处是机会。不信？看我卖他十万个肉松饼先！ ,2025-03-10 00:02
怪物来了,一刀斩斩斩, 万众期待下，研发十年的虚拟现实游戏《黑暗之地》上线，但高昂的售价让无数等待已久的玩家心生退却。同一时间，一款不知名的游戏借着《黑暗之地》的名头开始疯狂拉新。祁胜：我这里有《黑暗之地》的破解版下载链接，免费，保真！ ,2025-03-09 23:59
人在战锤，求你别赞美哆啦万机神,犹格在码字, 多年以后，面对火星上立起的哆啦A梦巨像，全宇宙最尊重安格隆的人、帝皇的虔诚信徒（大概）、哆啦考尔异父异母的亲兄弟、巢都下层区最富盛名的垃圾佬、阿巴顿一生挥之不去的阴影、亚空间通往现实宇宙的出口之一、恶魔垃圾桶、“我要见真正的巴尔之主！”、瓦半仙神选（也许）、大天使酱修复员、周.这是俺拾嘞.云，准会想起在冥府星系，圣吉列斯给自己托梦的那个遥远的下午。“所以，帝皇爷，这踏马真不能怪我啊！” ,2025-03-09 21:21
不许没收我的人籍,可怜的夕夕, “她本来就是恶魔，怎么可能是遇到我这个人类之后才被带坏的？那些批评家总在说一些很荒唐的东西。”1798年，枢机主教兰奇在接受记者采访时，被问起与那位流亡的魔族末裔公主的过往，以及近期魔族复苏的迹象，他表示：“我为捍卫世界和平做出了太多努力，我很确信，魔族在她的带领下绝无复国可能。”……1802年冬天，魔族复国成功。【请根据以上材料，指出导致魔族复国的主要战犯是谁，并说明为什么是兰奇。（10分）】——选自《帝国历史统考经典考题集》 ,2024-11-11 18:36
我师兄实在太稳健了,言归正传, 重生在封神大战之前的上古时代，李长寿成了一个小小的炼气士，没有什么气运加身，也不是什么注定的大劫之子，他只有一个想要长生不老的修仙梦。为了能在残酷的洪荒安身立命，他努力不沾因果，杀人必扬其灰，凡事谋而后动，从不轻易步入危险之中。藏底牌，修遁术，炼丹毒，掌神通，不动稳如老狗，一动石破天惊，动后悄声走人。本来李长寿规划中，自己会一直躲在山中平安无事的修行成仙，直到有一年，他的老师父静极思动，又给他……收了个师妹回来……【PS：暂时不开新群，五群（1098711961）壹群（474095492）贰群（836797636）叁群（398929196）肆群（1071059242）贯彻到底，轻松修仙！】 ,2022-11-25 16:18
我！清理员！,鱼狱圄, “拿好，这是你这周的薪水。”抬手递了个小袋子过来后，桌后面翘着二郎腿的女人随手在小本子上勾了一下，随即头也不抬地挥手撵人道：“记得自己去报一下税……下一个！”“等等！”把小袋子里的钱币倒出来后，看着掌心八枚大的一枚小的，总共九枚脏兮兮的硬币，李昂不由得震惊地瞪大了双眼，恨不能当场扑过去和她决一死战。“该死的！我这周二才刚击退了妄图侵蚀世界的邪神！你个混蛋居然连救世主的工资也要扣？” ,2025-03-09 23:21
制皮百年，我成了魔门巨头,是桃花酥呀, 重生正邪相争的仙魔世界，宋延被劫入魔门傀儡宗，因天赋问题，被分配成了制皮杂役。傀儡之道，博大精深，皮影傀儡，纸人傀儡，血尸傀儡。宋延需得按照正式弟子要求，制作出合适的皮影人、皮影兽甚至是皮影建筑。在制皮时，系统意外觉醒，只要他制皮就能提升寿元，悟性。时光荏苒，再回首，宋延已成魔宗巨头，见万年时光，睹天下更替。 ,2025-03-09 17:00
天倾之后,佛前献花, 我们的世界被污染了。超凡生物的出现，鬼怪的传说，修行与进化，奇物与术的碰撞，跨界的大门被打开，有人争渡，有人逃离......这一切的开端都在天倾之后。 ,2025-03-10 00:10
重生：开局逮到高冷校花超市偷窃,陆远秋, 重生校园时代，陆远秋照看自家开的超市，却在监控下发现一位容貌清丽的少女正在偷拿货架上的商品。拍摄证据后，陆远秋将其带到仓库内。“拿了多少？”少女背靠墙壁，沉默寡言：“没有了，就这些。”陆远秋认识她。少女名叫白清夏，跟他一个学校。高冷，生人勿近，冷面校花，通通是她的代名词。只是别人眼中那不可亵渎的白月光，今天竟以这种方式被自己逼到了墙角里。陆远秋默默告诉自己，今天无论如何也不能放她走。前一世，白清夏在超市里做了同样的事情，但陆远秋顾及对方面子，选择了视而不见。结果白清夏出门后就遭遇了一场车祸。这件事成了陆远秋心中的钉子，倘若那天，他狠心拦下白清夏，后面的惨剧就不会发生。所以这次，他要拖延时间，要对校花进行严厉的批评教育！看着角落里屈辱到眼眶发红的校花，陆远秋继续质问：“你确定就这些？”“校服里面鼓鼓囊囊的，是不是还藏着东西？！” ,2025-03-10 00:26
西游：开局拜师菩提祖师,阿牛要吃菜, 文王拉车八百步，定周朝八百年江山。姜缘于西周之时，大梦一场，恍若隔世，惊觉花非花，雾非雾，我非我。姜缘四岁之时决心寻道，求个长生，他见双亲俱在，将心暗藏，只道侍奉双亲一世，方寻仙问道。十六之时，双亲逝世，他毅然决然的遣散下人，一把火烧掉故居，周游寻道。十九之时，他寻得道人，苦心拜师，不得入门。二十九时，他成功拜入道人门下。“敢问师父法名？”“菩提！”这竟是西游！我师父竟是菩提祖师！ ,2025-03-09 23:52
鸣龙,关关公子, “事情是这样的，我当初身陷绝境，意外遇见了一条龙，它非说我是习武奇才，要给我指条通仙大道……”“这就是你挖开魔神陵，给妖魔当奴仆的理由？！”“我谢尽欢从不屈居人下，它才是奴仆，准确来说，我是被一条龙服务过……”……已有完本万订《世子很凶》《仙子很凶》《女侠且慢》，感兴趣的朋友可以先看老书~ ,03-10 07:58
重生日常修仙,庭院阳光好, 元婴真君渡劫失败，重回学生时代。2013年，移动互联网刚刚兴起，滚滚时代洪流下，一个修仙者的日常。——————————【日常】【学生】【恋爱】【互联网】【现代版修炼】【赚钱】【智商在线】 ,2025-03-09 23:57
