房屋标题,房屋类型,房屋面积,房屋朝向,房屋楼层,建造年代,楼盘,房屋地址,房屋价格,每平米/元
首付30万抢中央公园轻轨洋房 正规三房两卫格局 总价145万,3室2厅2卫,89㎡,南北,中层(共8层),2021年建造,荣盛鹿山府,"渝北-中央公园-金州大道,近万康路",145万,16293元/㎡
渝北中央公园旁丶轻轨50米三轻轨交汇丶保利品质三房丶数据谷,3室2厅2卫,95㎡,南北,中层(共8层),2000年建造,保利和光尘樾,"渝北-悦来-悦清大道,近悦港大道",150万,15790元/㎡
两江新区洋房产品，交通便利全新加推3室两厅两卫洋房产品,3室2厅2卫,98.8㎡,南北,中层(共8层),2021年建造,保亿御景玖园,"北碚-蔡家-蔡支路,近金兴大道",152万,15385元/㎡
渝北！公园东 150万买 10号轻轨鹿山旁  纯洋房社区,3室2厅2卫,99㎡,南北,中层(共8层),2020年建造,荣盛鹿山府,"渝北-中央公园-金州大道,近万康路",145万,14647元/㎡
业主诚心出售！洋房！带露台！使用面积大！户型好！无浪费！安静,3室2厅2卫,84㎡,北,中层(共7层),2017年建造,鲁能泰山7号十二街区,渝北-中央公园-嘉业路1号,195万,23215元/㎡
85平 满二  住房 3室2厅 电梯房 鲁能泰山7号十九街区,3室2厅2卫,85㎡,北,中层(共9层),2018年建造,鲁能泰山7号十九街区,"渝北-中央公园-兰桂大道,近金山大道",180万,21177元/㎡
大坪万科锦尚三期精装三房，未住人，业主换房急售,3室2厅1卫,88.9㎡,东,低层(共10层),2016年建造,万科锦尚,九龙坡-石桥铺-罗汉沟26号,180万,20248元/㎡
急售好房推荐中央公园 鲁能品质洋房 三房朝南 业主诚心稳定,3室2厅2卫,89㎡,南,中层(共9层),2019年建造,鲁能泰山7号十八街区,"渝北-中央公园-兰桂大道,近金山大道",182万,20450元/㎡
业主急售中央公园豪华装修3房，周边配套成熟，紧邻轻轨商圈公园,3室2厅2卫,87㎡,北,中层(共7层),2017年建造,鲁能泰山7号十二街区,渝北-中央公园-嘉业路1号,190万,21840元/㎡
鲁能泰山7号十七街区 180万 电梯房 南北通透 3室2厅,3室2厅2卫,85㎡,南北,低层(共9层),2017年建造,鲁能泰山7号十七街区,渝北-中央公园-博汇路10号,180万,21177元/㎡
业主稳定，价格可谈！纯洋房组团，内圈位置，拎包入住，看房方便,3室2厅2卫,96.6㎡,北,中层(共11层),2017年建造,康田蔚蓝海(B区),渝北-照母山-星融路66号,180万,18632元/㎡
急售！金科东方王榭跃层洋房精装三房双卫中间楼层朝中庭配套成熟,3室2厅2卫,99㎡,南北,中层(共6层),2008年建造,金科东方王榭,渝北-人和-金开大道3号,180万,18182元/㎡
业主急售带车位 金科别墅品质 居家安静 临近融创渝乐小镇,3室2厅1卫,95.7㎡,南,低层(共11层),2017年建造,金科天宸一街区,沙坪坝-土主-永祥路106号,181万,18922元/㎡
价格真实，业主诚心出售，朝南中庭，采光好。户型方正。近商业。,3室2厅2卫,86㎡,南,中层(共9层),2017年建造,鲁能泰山7号十八街区,"渝北-中央公园-兰桂大道,近金山大道",192万,22326元/㎡
江北核心地段品质小区房双轻轨央企品质户型方正,3室2厅2卫,98㎡,南北,中层(共8层),2020年建造,保利阅江台,"江北-石马河-盘溪路,近盘溪一支路",184万,18776元/㎡
中央公园带露台洋房，周边配套成熟，紧邻轻轨商圈公园，业主急售,3室2厅2卫,86㎡,南,中层(共7层),2017年建造,鲁能泰山7号十二街区,渝北-中央公园-嘉业路1号,185万,21512元/㎡
融创凡尔赛香榭 精装修 195万 电梯房 诚心出售 价格可议,3室2厅2卫,97㎡,南北,中层(共8层),2014年建造,融创凡尔赛香榭,渝北-照母山-星融路15号,195万,20104元/㎡
3室2厅 85平 185万 满二 楼层好 视野无遮挡,3室2厅2卫,85㎡,南,低层(共9层),2017年建造,鲁能泰山7号十七街区,渝北-中央公园-博汇路10号,185万,21765元/㎡
鲁能洋房三房双卫超中庭轻轨都在旁边,3室2厅2卫,85㎡,南,低层(共9层),2017年建造,鲁能泰山7号十九街区,"渝北-中央公园-兰桂大道,近金山大道",186万,21883元/㎡
金科天籁城美社 2室2厅 满五 143万 楼层好 视野无遮挡,2室2厅2卫,93㎡,南北,中层(共11层),2005年建造,金科天籁城美社,渝北-人和-双宁路172号,143万,15377元/㎡
沙区 城城 陈家桥 纯洋房 智慧小区 7米阔景阳台,3室2厅2卫,99㎡,南北,中层(共8层),2019年建造,华远海蓝和光,沙坪坝-陈家桥-慧堂路,141.9万,14334元/㎡
中央公园稀有小户型加推！轻轨200米！成熟配套！,3室2厅2卫,99㎡,南北,中层(共8层),2020年建造,荣盛鹿山府,"渝北-中央公园-金州大道,近万康路",148.88万,15039元/㎡
电梯房 南北通透 150万 华远海蓝和光 采光好 周边商圈成,3室2厅2卫,99㎡,南北,中层(共8层),2020年建造,华远海蓝和光,沙坪坝-陈家桥-慧堂路,150万,15152元/㎡
145万买三房中央公园轻轨站500米 洋房社区加推小户型,3室2厅2卫,97㎡,南北,中层(共8层),2020年建造,华润公园九里,渝北-中央公园-玉谷路23号,145万,14949元/㎡
中央公园轻轨洋房，投资自住都是 之选， 户型端正性价比高,3室2厅2卫,99㎡,南北,中层(共8层),2021年建造,荣盛鹿山府,"渝北-中央公园-金州大道,近万康路",140万,14142元/㎡
渝北中央公园  鹿山轻轨站就在旁边 高端品质,3室2厅2卫,89㎡,南北,中层(共8层),2021年建造,荣盛鹿山府,"渝北-中央公园-金州大道,近万康路",149万,16742元/㎡
中央公园旁边 唔悦广场旁 清水三房,3室2厅2卫,85㎡,北,中层(共9层),2017年建造,鲁能泰山7号十七街区,渝北-中央公园-博汇路10号,180万,21177元/㎡
渝中 万科锦尚3期洋房 2018年次新小区 三轻轨 还有车位,3室2厅1卫,88.9㎡,东,低层(共11层),2018年建造,万科锦尚,九龙坡-石桥铺-罗汉沟26号,180万,20248元/㎡
100平 板式洋房，简单基装修正规三室两卫，小区环境优美,3室2厅2卫,97㎡,南,中层(共8层),2017年建造,融创凡尔赛香榭,渝北-照母山-星融路15号,195万,20104元/㎡
鲁能泰山洋房4房2卫，朝中庭，采光好，业主诚心出售,3室2厅2卫,85㎡,南,中层(共9层),2019年建造,鲁能泰山7号十九街区,"渝北-中央公园-兰桂大道,近金山大道",185万,21765元/㎡
热爆中央公园轻轨房 公园环绕 周边成熟 地铁三百米 错过再无,3室2厅2卫,89㎡,南北,中层(共8层),2021年建造,荣盛鹿山府,"渝北-中央公园-金州大道,近万康路",140万,15731元/㎡
业主急售！万科锦尚三期洋房！精装从未住过人，带车位,3室2厅1卫,88.9㎡,南北,低层(共10层),2018年建造,万科锦尚,九龙坡-石桥铺-罗汉沟26号,190万,21373元/㎡
！渝北中央公园洋房社区 10号轻轨房 高端品质 配套成熟,3室2厅2卫,97㎡,南北,中层(共8层),2018年建造,荣盛鹿山府,"渝北-中央公园-金州大道,近万康路",140万,14433元/㎡
惊喜！渝北！公园东10号轻轨鹿山旁纯洋房社区,3室2厅2卫,99㎡,南北,中层(共8层),2020年建造,荣盛鹿山府,"渝北-中央公园-金州大道,近万康路",144万,14546元/㎡
首付30万抢中央公园轻轨洋房 正规三房两卫格局 总价143万,3室2厅2卫,89㎡,南北,中层(共8层),2021年建造,荣盛鹿山府,"渝北-中央公园-金州大道,近万康路",143万,16068元/㎡
万科锦尚洋房 18年次新小区 三轻轨,3室2厅1卫,88.9㎡,东,低层(共11层),2018年建造,万科锦尚,九龙坡-石桥铺-罗汉沟26号,185万,20810元/㎡
中央公园三房两卫150万起10号轻轨房配套成熟,3室2厅2卫,97㎡,南北,中层(共8层),2021年建造,荣盛鹿山府,"渝北-中央公园-金州大道,近万康路",155万,15980元/㎡
3室2厅 万科锦尚 满二  住房 电梯房 诚心出售 价格可议,3室2厅1卫,88.9㎡,东,低层(共10层),2018年建造,万科锦尚,九龙坡-石桥铺-罗汉沟26号,189万,21260元/㎡
渝北公园，特推！鹿山轻轨站旁，洋房三房双卫，南北通透,3室2厅2卫,99㎡,南北,中层(共8层),2021年建造,荣盛鹿山府,"渝北-中央公园-金州大道,近万康路",142万,14344元/㎡
万科锦尚三期 三房带车位出售 随时看房,3室2厅1卫,88.9㎡,东北,低层(共10层),2015年建造,万科锦尚,九龙坡-石桥铺-罗汉沟26号,185万,20810元/㎡
金科天籁城美社 2室2厅 满五 143万 楼层好 视野无遮挡,2室2厅2卫,93㎡,南北,中层(共11层),2005年建造,金科天籁城美社,渝北-人和-双宁路172号,143万,15377元/㎡
沙区 城城 陈家桥 纯洋房 智慧小区 7米阔景阳台,3室2厅2卫,99㎡,南北,中层(共8层),2019年建造,华远海蓝和光,沙坪坝-陈家桥-慧堂路,141.9万,14334元/㎡
中央公园稀有小户型加推！轻轨200米！成熟配套！,3室2厅2卫,99㎡,南北,中层(共8层),2020年建造,荣盛鹿山府,"渝北-中央公园-金州大道,近万康路",148.88万,15039元/㎡
中央公园小洋房丶轻轨200米丶南北通透丶周边配套成熟丶,3室2厅2卫,99㎡,南北,高层(共6层),2020年建造,荣盛鹿山府,"渝北-中央公园-金州大道,近万康路",150万,15152元/㎡
西区高品质洋房，临轻轨，交通方便，周边配套成熟，购物便利。,3室2厅2卫,99㎡,南北,中层(共6层),2020年建造,华远海蓝和光,沙坪坝-陈家桥-慧堂路,146.6万,14809元/㎡
！还不起按揭！旁边是八钟和巴蜀丶近公园近商圈丶轻轨50米,3室2厅1卫,94㎡,南,中层(共8层),2018年建造,公园大道,"渝北-中央公园-公园东路,近同茂大道",158.5万,16869元/㎡
！渝北中央公园洋房社区 10号轻轨房 高端品质 配套成熟,3室2厅2卫,97㎡,南北,中层(共8层),2018年建造,荣盛鹿山府,"渝北-中央公园-金州大道,近万康路",140万,14433元/㎡
渝北公园 轻轨200米 花园洋房 双公园环绕 配套成熟可以看,3室2厅2卫,99㎡,南北,中层(共11层),2021年建造,荣盛鹿山府,"渝北-中央公园-金州大道,近万康路",145万,14647元/㎡
渝北中央公园 鹿山轻轨站旁 品质洋房 大横厅大阳台,3室2厅2卫,99㎡,南北,高层(共7层),2020年建造,荣盛鹿山府,"渝北-中央公园-金州大道,近万康路",146万,14748元/㎡
在售中央公园西区 荣盛花园洋房 正规三房 配套齐全,3室2厅2卫,89㎡,南北,中层(共8层),2020年建造,荣盛鹿山府,"渝北-中央公园-金州大道,近万康路",149.8万,16832元/㎡
特推！鹿山轻轨旁，中央公园小洋楼双卫，南北通透,3室2厅2卫,99㎡,南北,中层(共8层),2020年建造,荣盛鹿山府,"渝北-中央公园-金州大道,近万康路",150万,15152元/㎡
！年底！首付14万起买公园纯洋房弘阳昕悦棠,3室2厅1卫,85㎡,南,中层(共8层),2019年建造,弘阳昕悦棠,渝北-两路-桂馥大道25号,140万,16471元/㎡
大学城小户型洋房精致户型，智慧生活，医疗完善，融创茂旁,3室2厅2卫,99㎡,东南,中层(共8层),2018年建造,华远海蓝和光,沙坪坝-陈家桥-慧堂路,145万,14647元/㎡
回兴首付2成买轻轨洋房，板式结构南北通透户型，横厅大阳台,3室2厅2卫,99㎡,南北,中层(共8层),2020年建造,爱情天宸万璟,渝北-农业园区-服装城大道,140万,14142元/㎡
开发商折扣小洋楼！园博园旁 万科精装  带地暖新风系统,3室2厅2卫,95.3㎡,南北,低层(共11层),2020年建造,万科金开悦府,"渝北-悦来-云卉路,近金兴大道",142万,14901元/㎡
在售（公园洋房）轻轨10号线旁鹿山站南北通透户型好配套完善,3室2厅2卫,97㎡,南北,中层(共8层),2021年建造,荣盛鹿山府,"渝北-中央公园-金州大道,近万康路",146万,15052元/㎡
内部特价两江新区中式洋房精装现房在售抢完清盘靠近轻轨和商业,3室2厅2卫,92㎡,南北,中层(共6层),2020年建造,建发和玺,北碚-蔡家-金兴大道,150万,16305元/㎡
新房源！惊爆价！直降5万 低楼层 正规两房 朝向安静！,2室2厅1卫,90㎡,南北,低层(共9层),2005年建造,晨光小区,"沙坪坝-三峡广场-汉渝路,近龙泉路",148万,16445元/㎡
中央公园轻轨10号线旁 板式通透纯洋房 成熟配套出行方便,3室2厅1卫,85㎡,南北,中层(共8层),2021年建造,弘阳昕悦棠,渝北-两路-桂馥大道25号,140万,16471元/㎡
首开 大学城核心  佳兆业品牌精装修洋房  对面重大树人,3室2厅2卫,89㎡,南北,中层(共9层),2021年建造,佳兆业珑樾壹号,"沙坪坝-曾家-大学城南二路,近思贤路",149.9万,16843元/㎡
特价！渝北中央公园融创品牌精装   轻轨旁边,3室2厅2卫,85㎡,南北,中层(共8层),2021年建造,融创隐溪晓院,"渝北-中央公园-悦港大道,近土两路",155万,18236元/㎡
（花园洋房）中央公园十号线旁 三房可做四房 版式南北通透,3室2厅2卫,99㎡,南北,中层(共8层),2020年建造,弘阳昕悦棠,渝北-两路-桂馥大道25号,158.5万,16011元/㎡
151万买悦来品质小高层三公园环绕近轻轨近嘉陵江大横厅设计,3室2厅2卫,99.4㎡,南北,中层(共11层),2021年建造,江山雲出,渝北-礼嘉-古树坪路86号,151万,15189元/㎡
照母山北！园博园对面，环境优美 万科精装大3房！轻轨5号线旁,3室2厅2卫,98.6㎡,南,中层(共8层),2019年建造,万科金开悦府,"渝北-悦来-云卉路,近金兴大道",146万,14809元/㎡
悦来万科精装两房一楼带花园,3室2厅2卫,89㎡,南北,中层(共8层),2018年建造,万科未来星光,"渝北-悦来-金兴大道,近翠岗路",145万,16293元/㎡
保利  开盘，位置尚好！开发商做口碑！.,3室2厅2卫,95㎡,南北,中层(共8层),2000年建造,保利和光尘樾,"渝北-悦来-悦清大道,近悦港大道",150.5万,15843元/㎡
渝北公园，鹿山轻轨站旁，洋房三房双卫，南北通透，成熟社区,3室2厅2卫,99㎡,南北,中层(共8层),2021年建造,荣盛鹿山府,"渝北-中央公园-金州大道,近万康路",149万,15051元/㎡
150万   住房 99平 电梯房 3室2厅 华远海蓝和光,3室2厅2卫,99㎡,南北,中层(共8层),2019年建造,华远海蓝和光,沙坪坝-陈家桥-慧堂路,150万,15152元/㎡
两江新区 蔡家轻轨站附近 龙湖天街800米 纯洋房叠拼社区,3室2厅2卫,98.8㎡,南北,中层(共8层),2021年建造,保亿御景玖园,"北碚-蔡家-蔡支路,近金兴大道",145万,14677元/㎡
住房 3室2厅 南北通透 电梯房 房东急置换,3室2厅2卫,99㎡,南北,中层(共8层),2020年建造,中梁海成南山云璟,"南岸-四公里-广黔路,近海峡路",150万,15152元/㎡
渝北中央公园 138万买纯洋房 200多米轻轨站 公园环绕,3室2厅1卫,86.5㎡,南北,中层(共8层),2020年建造,弘阳昕悦棠,渝北-两路-桂馥大道25号,148万,17110元/㎡
中央公园荣盛鹿山府，公园房，近轻轨，五星体验之家大阳台房子,3室2厅2卫,89㎡,南北,中层(共8层),2021年建造,荣盛鹿山府,"渝北-中央公园-金州大道,近万康路",150万,16854元/㎡
渝北！公园东 150万买 10号轻轨鹿山旁  纯洋房社区,3室2厅2卫,99㎡,南北,中层(共8层),2020年建造,荣盛鹿山府,"渝北-中央公园-金州大道,近万康路",145万,14647元/㎡
双轨交汇！ 纯粹高端洋墅项目 房源有限 精装清水,3室2厅2卫,90㎡,南北,中层(共8层),2019年建造,融信海月平湖,渝北-回兴-宝桐路56号,155万,17223元/㎡
渝北中央公园配套成熟360万方商业横厅设计精装小户,3室2厅1卫,90㎡,南,中层(共8层),2019年建造,海成云境,渝北-空港新城-睦邻路10号,150万,16667元/㎡
杨家坪超人气楼盘地段总价150万左右买九龙半岛品质洋房，,3室2厅2卫,90㎡,南北,中层(共8层),2021年建造,荣安九龙壹号,"九龙坡-杨家坪-龙江支路,近龙江路",152万,16889元/㎡
140万3室2厅99平中梁海成南山云璟楼层好洋房,3室2厅2卫,99㎡,南北,中层(共8层),2019年建造,中梁海成南山云璟,"南岸-四公里-广黔路,近海峡路",140万,14142元/㎡
中 央公园荣盛品质洋房，轻轨旁，1站公园里，交通便利繁华地段,3室2厅2卫,99㎡,南北,中层(共8层),2021年建造,荣盛鹿山府,"渝北-中央公园-金州大道,近万康路",145万,14647元/㎡
电梯房 南北通透 150万 华远海蓝和光 采光好 周边商圈成,3室2厅2卫,99㎡,南北,中层(共8层),2020年建造,华远海蓝和光,沙坪坝-陈家桥-慧堂路,150万,15152元/㎡
公园品质洋房鹿山府 出门即轻轨站  两江国际商务,3室2厅2卫,99㎡,南北,中层(共8层),2021年建造,荣盛鹿山府,"渝北-中央公园-金州大道,近万康路",149万,15051元/㎡
渝北中央公园，特推！鹿山轻轨站旁，洋房三房双卫，南北通透,3室2厅2卫,99㎡,南北,中层(共8层),2020年建造,荣盛鹿山府,"渝北-中央公园-金州大道,近万康路",155万,15657元/㎡
中央公园小户型小洋楼！出门即轻轨丶员工内购价丶出门即轻轨丶,3室2厅2卫,99㎡,南,高层(共7层),2020年建造,荣盛鹿山府,"渝北-中央公园-金州大道,近万康路",140万,14142元/㎡
渝北融信精装洋房临近轻轨可首付两成送新风带地暖!,3室2厅2卫,90㎡,南北,中层(共8层),2021年建造,融信海月平湖,渝北-回兴-宝桐路56号,145万,16112元/㎡
沙坪坝三星智慧小区花园洋房，树人，3中家门口，配套成熟,3室2厅2卫,99.6㎡,南北,中层(共8层),2011年建造,华远海蓝和光,沙坪坝-陈家桥-慧堂路,147万,14765元/㎡
公园小洋房轻轨10号线旁鹿山南北通透户型好配套完善,3室2厅2卫,97㎡,南北,中层(共8层),2021年建造,荣盛鹿山府,"渝北-中央公园-金州大道,近万康路",149万,15361元/㎡
渝北！中央公园东 150万买 10号轻轨鹿山旁  纯洋房社区,3室2厅2卫,97㎡,南北,中层(共11层),2020年建造,荣盛鹿山府,"渝北-中央公园-金州大道,近万康路",150万,15464元/㎡
特价房 华远海蓝和光148万 3室2厅 电梯房 周边成熟,3室2厅2卫,99㎡,南北,中层(共6层),2020年建造,华远海蓝和光,沙坪坝-陈家桥-慧堂路,148万,14950元/㎡
回兴3轻轨旁首付2成买精装洋房，温馨三居室，周边配套成熟,3室2厅2卫,90㎡,南北,中层(共8层),2020年建造,融信海月平湖,渝北-回兴-宝桐路56号,140万,15556元/㎡
！！！New，首付30万买 中央公园洋楼 方正3室 轻轨站旁,3室2厅2卫,99㎡,南北,中层(共8层),2020年建造,荣盛鹿山府,"渝北-中央公园-金州大道,近万康路",155.23万,15680元/㎡
员工特价！低总价150万！入住中央公园！鹿山轻轨站旁！,3室2厅2卫,97㎡,南北,中层(共8层),2020年建造,荣盛鹿山府,"渝北-中央公园-金州大道,近万康路",140万,14433元/㎡
西永成熟配套华远海南和光 3房2卫 1梯2户 南北通透改善型,3室2厅2卫,99㎡,南北,中层(共8层),2020年建造,华远海蓝和光,沙坪坝-陈家桥-慧堂路,147万,14849元/㎡
渝北！公园东 150万买 10号轻轨鹿山旁  纯洋房社区,3室2厅2卫,99㎡,南北,中层(共8层),2020年建造,荣盛鹿山府,"渝北-中央公园-金州大道,近万康路",145万,14647元/㎡
中央公园东 纯洋房社区品质3房 双商圈轻轨10号线鹿山旁,3室2厅2卫,97㎡,南北,中层(共11层),2021年建造,荣盛鹿山府,"渝北-中央公园-金州大道,近万康路",159.8万,16475元/㎡
中央公园高品质洋房 出门就是轻轨站  三轻轨线环绕 总高6楼,3室2厅2卫,99㎡,南北,中层(共6层),2021年建造,荣盛鹿山府,"渝北-中央公园-金州大道,近万康路",150万,15152元/㎡
大学城小户型洋房精致户型，智慧生活，医疗完善，融创茂旁,3室2厅2卫,99㎡,东南,中层(共8层),2018年建造,华远海蓝和光,沙坪坝-陈家桥-慧堂路,145万,14647元/㎡
一楼带花园丶清盘特价丶三轻轨地铁丶渝北回兴准现房洋房丶近商圈,3室2厅2卫,90㎡,南北,中层(共8层),2021年建造,融信海月平湖,渝北-回兴-宝桐路56号,144万,16000元/㎡
中央公园轻轨房！3号线10号线鹿山轻轨旁！三房双卫！周边成熟,3室2厅2卫,97㎡,南北,中层(共8层),2021年建造,荣盛鹿山府,"渝北-中央公园-金州大道,近万康路",152.88万,15761元/㎡
！渝北中央公园洋房社区 10号轻轨房 高端品质 配套成熟,3室2厅2卫,97㎡,南北,中层(共8层),2018年建造,荣盛鹿山府,"渝北-中央公园-金州大道,近万康路",140万,14433元/㎡
！渝北中央公园洋房社区 10号轻轨房 高端品质 配套成熟,3室2厅2卫,97㎡,南北,中层(共8层),2018年建造,荣盛鹿山府,"渝北-中央公园-金州大道,近万康路",140万,14433元/㎡
中央公园高品质洋房 出门就是轻轨站  三轻轨线环绕 总高6楼,3室2厅2卫,99㎡,南北,中层(共6层),2020年建造,荣盛鹿山府,"渝北-中央公园-金州大道,近万康路",158万,15960元/㎡
中央公园稀有小户型加推！轻轨200米！成熟配套！,3室2厅2卫,99㎡,南北,中层(共8层),2020年建造,荣盛鹿山府,"渝北-中央公园-金州大道,近万康路",148.88万,15039元/㎡
电梯房 南北通透 150万 华远海蓝和光 采光好 周边商圈成,3室2厅2卫,99㎡,南北,中层(共8层),2020年建造,华远海蓝和光,沙坪坝-陈家桥-慧堂路,150万,15152元/㎡
中央公园小洋房丶轻轨200米丶南北通透丶周边配套成熟丶,3室2厅2卫,99㎡,南北,高层(共6层),2020年建造,荣盛鹿山府,"渝北-中央公园-金州大道,近万康路",150万,15152元/㎡
西区高品质洋房，临轻轨，交通方便，周边配套成熟，购物便利。,3室2厅2卫,99㎡,南北,中层(共6层),2020年建造,华远海蓝和光,沙坪坝-陈家桥-慧堂路,146.6万,14809元/㎡
！还不起按揭！旁边是八钟和巴蜀丶近公园近商圈丶轻轨50米,3室2厅1卫,94㎡,南,中层(共8层),2018年建造,公园大道,"渝北-中央公园-公园东路,近同茂大道",158.5万,16869元/㎡
在售中央公园西区 荣盛花园洋房 正规三房 配套齐全,3室2厅2卫,89㎡,南北,中层(共8层),2020年建造,荣盛鹿山府,"渝北-中央公园-金州大道,近万康路",149.8万,16832元/㎡
特推！鹿山轻轨旁，中央公园小洋楼双卫，南北通透,3室2厅2卫,99㎡,南北,中层(共8层),2020年建造,荣盛鹿山府,"渝北-中央公园-金州大道,近万康路",150万,15152元/㎡
中央公园东 纯洋房社区品质3房 双商圈轻轨10号线鹿山旁,3室2厅2卫,97㎡,南北,中层(共11层),2021年建造,荣盛鹿山府,"渝北-中央公园-金州大道,近万康路",159.8万,16475元/㎡
！年底！首付14万起买公园纯洋房弘阳昕悦棠,3室2厅1卫,85㎡,南,中层(共8层),2019年建造,弘阳昕悦棠,渝北-两路-桂馥大道25号,140万,16471元/㎡
中央公园小户型小洋楼！出门即轻轨丶员工内购价丶出门即轻轨丶,3室2厅2卫,99㎡,南,高层(共7层),2020年建造,荣盛鹿山府,"渝北-中央公园-金州大道,近万康路",140万,14142元/㎡
回兴首付2成买轻轨洋房，板式结构南北通透户型，横厅大阳台,3室2厅2卫,99㎡,南北,中层(共8层),2020年建造,爱情天宸万璟,渝北-农业园区-服装城大道,140万,14142元/㎡
开发商折扣小洋楼！园博园旁 万科精装  带地暖新风系统,3室2厅2卫,95.3㎡,南北,低层(共11层),2020年建造,万科金开悦府,"渝北-悦来-云卉路,近金兴大道",142万,14901元/㎡
在售（公园洋房）轻轨10号线旁鹿山站南北通透户型好配套完善,3室2厅2卫,97㎡,南北,中层(共8层),2021年建造,荣盛鹿山府,"渝北-中央公园-金州大道,近万康路",146万,15052元/㎡
内部特价两江新区中式洋房精装现房在售抢完清盘靠近轻轨和商业,3室2厅2卫,92㎡,南北,中层(共6层),2020年建造,建发和玺,北碚-蔡家-金兴大道,150万,16305元/㎡
新房源！惊爆价！直降5万 低楼层 正规两房 朝向安静！,2室2厅1卫,90㎡,南北,低层(共9层),2005年建造,晨光小区,"沙坪坝-三峡广场-汉渝路,近龙泉路",148万,16445元/㎡
中央公园轻轨10号线旁 板式通透纯洋房 成熟配套出行方便,3室2厅1卫,85㎡,南北,中层(共8层),2021年建造,弘阳昕悦棠,渝北-两路-桂馥大道25号,140万,16471元/㎡
首开 大学城核心  佳兆业品牌精装修洋房  对面重大树人,3室2厅2卫,89㎡,南北,中层(共9层),2021年建造,佳兆业珑樾壹号,"沙坪坝-曾家-大学城南二路,近思贤路",149.9万,16843元/㎡
中央公园高品质洋房 出门就是轻轨站  三轻轨线环绕 总高6楼,3室2厅2卫,99㎡,南北,中层(共6层),2021年建造,荣盛鹿山府,"渝北-中央公园-金州大道,近万康路",150万,15152元/㎡
特价！渝北中央公园融创品牌精装   轻轨旁边,3室2厅2卫,85㎡,南北,中层(共8层),2021年建造,融创隐溪晓院,"渝北-中央公园-悦港大道,近土两路",155万,18236元/㎡
（花园洋房）中央公园十号线旁 三房可做四房 版式南北通透,3室2厅2卫,99㎡,南北,中层(共8层),2020年建造,弘阳昕悦棠,渝北-两路-桂馥大道25号,158.5万,16011元/㎡
151万买悦来品质小高层三公园环绕近轻轨近嘉陵江大横厅设计,3室2厅2卫,99.4㎡,南北,中层(共11层),2021年建造,江山雲出,渝北-礼嘉-古树坪路86号,151万,15189元/㎡
照母山北！园博园对面，环境优美 万科精装大3房！轻轨5号线旁,3室2厅2卫,98.6㎡,南,中层(共8层),2019年建造,万科金开悦府,"渝北-悦来-云卉路,近金兴大道",146万,14809元/㎡
悦来万科精装两房一楼带花园,3室2厅2卫,89㎡,南北,中层(共8层),2018年建造,万科未来星光,"渝北-悦来-金兴大道,近翠岗路",145万,16293元/㎡
